{
  "id": "example-0001",
  "schema_version": "0.3.0",
  "generator": {
    "version": "hand-made example",
    "data_version": "draft 0.3.0"
  },
  "seed": "example-rime-burr",
  "spice": 2,
  "inputs": {
    "class": "drone",
    "tier": "t1",
    "flavour": "allied",
    "role": null
  },
  "locks": [],
  "parts": {
    "class": "drone",
    "tier": "t1",
    "flavour": "allied",
    "nature": "uncrewed-machine",
    "availability": "open",
    "roles": {
      "primary": "scout",
      "secondary": ["disabler"]
    },
    "mobility": {
      "base": "hover",
      "handling": "drift",
      "traits": [],
      "speed": "fast"
    },
    "body": {
      "plan": "micro-bot",
      "size": "tiny",
      "count": 1
    },
    "armament": {
      "primary": {
        "family": "blades",
        "damage": "melee",
        "mount": "free-aim",
        "delivery": "attach",
        "range": "melee",
        "can_target": ["ground-vehicle"],
        "traits": ["mark"],
        "seat": "driver"
      },
      "secondary": {
        "family": "cryo",
        "damage": "cryo",
        "mount": "free-aim",
        "delivery": "beam",
        "range": "medium",
        "can_target": ["infantry", "ground-vehicle"],
        "traits": ["slow"],
        "seat": "driver"
      },
      "conditional": []
    },
    "armour": {
      "class": "light",
      "models": ["charge-shield"]
    },
    "crew": {
      "model": "solo",
      "solo_fallback": null,
      "passengers": null
    },
    "signature": {
      "pattern": "infest-vehicle",
      "variant": "tracker",
      "kind": "active",
      "seat": "driver",
      "cooldown": "medium"
    },
    "abilities": [],
    "modes": [],
    "resource": null,
    "on_death": ["respawn"]
  },
  "matchups": {
    "strengths": [
      {
        "ref": "delivery:attach",
        "why": "Once latched it is hard to hit and stays on until a shake-off, repair or EMP removes it; every hit the team lands builds toward the brittle window.",
        "paired_with": 0
      },
      {
        "ref": "speed:fast",
        "why": "The hover frame reaches vehicles quickly and slips away again.",
        "paired_with": 1
      }
    ],
    "weaknesses": [
      {
        "ref": "range:melee",
        "why": "It has to touch the vehicle, so it is exposed on the way in."
      },
      {
        "ref": "armour-class:light",
        "why": "A light frame: once its charged shield is gone, one burst ends it."
      }
    ],
    "countered_by": [
      {
        "ref": "weapon:machine-gun",
        "why": "Sustained fire stops it before it reaches the hull."
      },
      {
        "ref": "weapon:repair-tool",
        "why": "A repair beam pulls it off the host."
      },
      {
        "ref": "damage:emp",
        "why": "EMP drops its shield and knocks it off."
      },
      {
        "ref": "class:aircraft",
        "why": "Nothing on it can reach aircraft, and they can shoot it freely."
      }
    ],
    "counters": [
      {
        "ref": "class:vehicle",
        "why": "A ridden vehicle shows up for the whole team, and their focused fire turns it brittle."
      }
    ],
    "counterplay": [
      "Shoot it on the way in: it is tiny and lightly protected.",
      "Hold F to shake it off, or drive onto a repair pad.",
      "Break away from the enemy's guns: frost only builds while they hit you."
    ]
  },
  "text": {
    "name": "Rime Burr",
    "pitch": "A tiny Allied hover-drone that rides enemy vehicles and frosts them over until your team's fire shatters them.",
    "signature": {
      "name": "Frost Tag",
      "effect": "Latch onto an enemy vehicle: it shows on your team's minimap, and every hit your team lands while you ride adds frost; at full frost you are flung clear and the hull turns brittle for a short window, taking extra damage from every hit."
    },
    "team_play_hook": {
      "hook": "setup-finisher",
      "text": "Ride the tank while your team pours fire into it: every hit adds frost, and at full frost it turns brittle."
    },
    "how_it_plays": {
      "as_user": "Skim in fast, pounce on a vehicle and ride it while your team piles on; the more they hit it, the sooner it turns brittle and flings you clear. You can't fire while riding, so leap off early to chill infantry coming to help.",
      "as_target": "A pale glint lands on your hull, frost starts creeping across it and the enemy team sees you on their minimap. Hold F to shake it off, drive onto a repair pad, or get out of their fire: frost only builds when they hit you.",
      "teammates": "The ridden vehicle shows on your minimap. Every hit on it adds frost, and heavy hitters cash in on the brittle window; a repair player is the host's best friend.",
      "controls": [
        {
          "seat": "driver",
          "input": "LMB",
          "action": "Pounce and latch (Frost Tag)"
        },
        {
          "seat": "driver",
          "input": "RMB",
          "action": "Cryo beam: slows infantry and vehicles (not while latched)"
        },
        {
          "seat": "driver",
          "input": "Space",
          "action": "Leap off"
        }
      ],
      "tells": "A pale blue glint on the hull, a frost layer that visibly spreads across the vehicle from above as it fills, and a crack-and-flash when it turns brittle."
    }
  },
  "inspiration": {
    "patterns": ["infest-vehicle"],
    "source_units": ["ra3.soviet.terror-drone"]
  },
  "balance": {
    "cost_band": "low",
    "power": 4,
    "complexity": 3,
    "keys": 2,
    "flags": []
  },
  "created_at": "2026-10-17T12:00:00Z"
}
